{
 "type": "state",
 "request_id": 3,
 "protocol": 2,
 "bridge_version": "rlbridge-v2.0.0",
 "seed": 123456,
 "decision_id": 1,
 "decision_kind": "priority",
 "policy_controlled": true,
 "policy_action_applied": true,
 "ai_fallback_decisions": 0,
 "terminal": false,
 "truncated": false,
 "outcome": null,
 "illegal_action": false,
 "turn": 1,
 "phase": "MAIN1",
 "life_you": 20,
 "life_opp": 20,
 "hand_you_size": 6,
 "hand_opp_size": 7,
 "library_size": 53,
 "mana_pool_you": 0,
 "action_mask": [
  1,
  1,
  1,
  0,
  0,
  0,
  0,
  0,
  0,
  0,
  0,
  0,
  0,
  0,
  0,
  0,
  0,
  0,
  0,
  0,
  0,
  0,
  0,
  0,
  0,
  0,
  0,
  0,
  0,
  0,
  0,
  0,
  0,
  0,
  0,
  0,
  0,
  0,
  0,
  0,
  0,
  0,
  0,
  0,
  0,
  0,
  0,
  0,
  0,
  0,
  0,
  0,
  0,
  0,
  0,
  0,
  0,
  0,
  0,
  0,
  0,
  0,
  0,
  0,
  0,
  0,
  0,
  0,
  0,
  0,
  0,
  0,
  0,
  0,
  0,
  0,
  0,
  0,
  0,
  0,
  0,
  0,
  0,
  0,
  0,
  0,
  0,
  0,
  0,
  0,
  0,
  0,
  0,
  0,
  0,
  0,
  0,
  0,
  0,
  0,
  0,
  0,
  0,
  0,
  0,
  0,
  0,
  0,
  0,
  0,
  0,
  0,
  0,
  0,
  0,
  0,
  0,
  0,
  0,
  0,
  0,
  0,
  0,
  0,
  0,
  0,
  0,
  0,
  0,
  0,
  0,
  0,
  0,
  0,
  0,
  0,
  0,
  0,
  0,
  0,
  0,
  0,
  0,
  0,
  0,
  0,
  0,
  0,
  0,
  0,
  0,
  0,
  0,
  0,
  0,
  0,
  0,
  0,
  0,
  0,
  0,
  0,
  0,
  0,
  0,
  0,
  0,
  0,
  0,
  0,
  0,
  0,
  0,
  0,
  0,
  0,
  0,
  0,
  0,
  0,
  0,
  0,
  0,
  0,
  0,
  0,
  0,
  0,
  0,
  0,
  0,
  0,
  0,
  0,
  0,
  0,
  0,
  0,
  0,
  0,
  0,
  0,
  0,
  0,
  0,
  0,
  0,
  0,
  0,
  0,
  0,
  0,
  0,
  0,
  0,
  0,
  0,
  0,
  0,
  0,
  0,
  0,
  0,
  0,
  0,
  0,
  0,
  0,
  0,
  0,
  0,
  0,
  0,
  0,
  0,
  0,
  0,
  0,
  0,
  0,
  0,
  0,
  0,
  0,
  0,
  0,
  0,
  0,
  0,
  0,
  0,
  0,
  0,
  0,
  0,
  0,
  0,
  0,
  0,
  0,
  0,
  0,
  0,
  0,
  0,
  0,
  0,
  0,
  0,
  0,
  0,
  0,
  0,
  0,
  0,
  0,
  0,
  0,
  0,
  0,
  0,
  0,
  0,
  0,
  0,
  0,
  0,
  0,
  0,
  0,
  0,
  0,
  0,
  0,
  0,
  0,
  0,
  0,
  0,
  0,
  0,
  0,
  0,
  0,
  0,
  0,
  0,
  0,
  0,
  0,
  0,
  0,
  0,
  0,
  0,
  0,
  0,
  0,
  0,
  0,
  0,
  0,
  0,
  0,
  0,
  0,
  0,
  0,
  0,
  0,
  0,
  0,
  0,
  0,
  0,
  0,
  0,
  0,
  0,
  0,
  0,
  0,
  0,
  0,
  0,
  0,
  0,
  0,
  0,
  0,
  0,
  0,
  0,
  0,
  0,
  0,
  0,
  0,
  0,
  0,
  0,
  0,
  0,
  0,
  0,
  0,
  0,
  0,
  0,
  0,
  0,
  0,
  0,
  0,
  0,
  0,
  0,
  0,
  0,
  0,
  0,
  0,
  0,
  0,
  0,
  0,
  0,
  0,
  0,
  0,
  0,
  0,
  0,
  0,
  0,
  0,
  0,
  0,
  0,
  0,
  0,
  0,
  0,
  0,
  0,
  0,
  0,
  0,
  0,
  0,
  0,
  0,
  0,
  0,
  0,
  0,
  0,
  0,
  0,
  0,
  0,
  0,
  0,
  0,
  0,
  0,
  0,
  0,
  0,
  0,
  0,
  0,
  0,
  0,
  0,
  0,
  0,
  0,
  0,
  0,
  0,
  0,
  0,
  0,
  0,
  0,
  0,
  0,
  0,
  0,
  0,
  0,
  0,
  0,
  0,
  0,
  0,
  0,
  0,
  0,
  0,
  0,
  0,
  0,
  0,
  0,
  0,
  0,
  0,
  0,
  0,
  0,
  0,
  0,
  0,
  0,
  0,
  0,
  0,
  0,
  0,
  0,
  0,
  0,
  0,
  0,
  0,
  0,
  0,
  0,
  0,
  0,
  0,
  0,
  0,
  0,
  0,
  0,
  0,
  0,
  0,
  0,
  0,
  0,
  0,
  0,
  0,
  0,
  0,
  0,
  0,
  0
 ],
 "action_source_indices": [
  -1,
  3,
  5,
  -1,
  -1,
  -1,
  -1,
  -1,
  -1,
  -1,
  -1,
  -1,
  -1,
  -1,
  -1,
  -1,
  -1,
  -1,
  -1,
  -1,
  -1,
  -1,
  -1,
  -1,
  -1,
  -1,
  -1,
  -1,
  -1,
  -1,
  -1,
  -1,
  -1,
  -1,
  -1,
  -1,
  -1,
  -1,
  -1,
  -1,
  -1,
  -1,
  -1,
  -1,
  -1,
  -1,
  -1,
  -1,
  -1,
  -1,
  -1,
  -1,
  -1,
  -1,
  -1,
  -1,
  -1,
  -1,
  -1,
  -1,
  -1,
  -1,
  -1,
  -1,
  -1,
  -1,
  -1,
  -1,
  -1,
  -1,
  -1,
  -1,
  -1,
  -1,
  -1,
  -1,
  -1,
  -1,
  -1,
  -1,
  -1,
  -1,
  -1,
  -1,
  -1,
  -1,
  -1,
  -1,
  -1,
  -1,
  -1,
  -1,
  -1,
  -1,
  -1,
  -1,
  -1,
  -1,
  -1,
  -1,
  -1,
  -1,
  -1,
  -1,
  -1,
  -1,
  -1,
  -1,
  -1,
  -1,
  -1,
  -1,
  -1,
  -1,
  -1,
  -1,
  -1,
  -1,
  -1,
  -1,
  -1,
  -1,
  -1,
  -1,
  -1,
  -1,
  -1,
  -1,
  -1,
  -1,
  -1,
  -1,
  -1,
  -1,
  -1,
  -1,
  -1,
  -1,
  -1,
  -1,
  -1,
  -1,
  -1,
  -1,
  -1,
  -1,
  -1,
  -1,
  -1,
  -1,
  -1,
  -1,
  -1,
  -1,
  -1,
  -1,
  -1,
  -1,
  -1,
  -1,
  -1,
  -1,
  -1,
  -1,
  -1,
  -1,
  -1,
  -1,
  -1,
  -1,
  -1,
  -1,
  -1,
  -1,
  -1,
  -1,
  -1,
  -1,
  -1,
  -1,
  -1,
  -1,
  -1,
  -1,
  -1,
  -1,
  -1,
  -1,
  -1,
  -1,
  -1,
  -1,
  -1,
  -1,
  -1,
  -1,
  -1,
  -1,
  -1,
  -1,
  -1,
  -1,
  -1,
  -1,
  -1,
  -1,
  -1,
  -1,
  -1,
  -1,
  -1,
  -1,
  -1,
  -1,
  -1,
  -1,
  -1,
  -1,
  -1,
  -1,
  -1,
  -1,
  -1,
  -1,
  -1,
  -1,
  -1,
  -1,
  -1,
  -1,
  -1,
  -1,
  -1,
  -1,
  -1,
  -1,
  -1,
  -1,
  -1,
  -1,
  -1,
  -1,
  -1,
  -1,
  -1,
  -1,
  -1,
  -1,
  -1,
  -1,
  -1,
  -1,
  -1,
  -1,
  -1,
  -1,
  -1,
  -1,
  -1,
  -1,
  -1,
  -1,
  -1,
  -1,
  -1,
  -1,
  -1,
  -1,
  -1,
  -1,
  -1,
  -1,
  -1,
  -1,
  -1,
  -1,
  -1,
  -1,
  -1,
  -1,
  -1,
  -1,
  -1,
  -1,
  -1,
  -1,
  -1,
  -1,
  -1,
  -1,
  -1,
  -1,
  -1,
  -1,
  -1,
  -1,
  -1,
  -1,
  -1,
  -1,
  -1,
  -1,
  -1,
  -1,
  -1,
  -1,
  -1,
  -1,
  -1,
  -1,
  -1,
  -1,
  -1,
  -1,
  -1,
  -1,
  -1,
  -1,
  -1,
  -1,
  -1,
  -1,
  -1,
  -1,
  -1,
  -1,
  -1,
  -1,
  -1,
  -1,
  -1,
  -1,
  -1,
  -1,
  -1,
  -1,
  -1,
  -1,
  -1,
  -1,
  -1,
  -1,
  -1,
  -1,
  -1,
  -1,
  -1,
  -1,
  -1,
  -1,
  -1,
  -1,
  -1,
  -1,
  -1,
  -1,
  -1,
  -1,
  -1,
  -1,
  -1,
  -1,
  -1,
  -1,
  -1,
  -1,
  -1,
  -1,
  -1,
  -1,
  -1,
  -1,
  -1,
  -1,
  -1,
  -1,
  -1,
  -1,
  -1,
  -1,
  -1,
  -1,
  -1,
  -1,
  -1,
  -1,
  -1,
  -1,
  -1,
  -1,
  -1,
  -1,
  -1,
  -1,
  -1,
  -1,
  -1,
  -1,
  -1,
  -1,
  -1,
  -1,
  -1,
  -1,
  -1,
  -1,
  -1,
  -1,
  -1,
  -1,
  -1,
  -1,
  -1,
  -1,
  -1,
  -1,
  -1,
  -1,
  -1,
  -1,
  -1,
  -1,
  -1,
  -1,
  -1,
  -1,
  -1,
  -1,
  -1,
  -1,
  -1,
  -1,
  -1,
  -1,
  -1,
  -1,
  -1,
  -1,
  -1,
  -1,
  -1,
  -1,
  -1,
  -1,
  -1,
  -1,
  -1,
  -1,
  -1,
  -1,
  -1,
  -1,
  -1,
  -1,
  -1,
  -1,
  -1,
  -1,
  -1,
  -1,
  -1,
  -1,
  -1,
  -1,
  -1,
  -1,
  -1,
  -1,
  -1,
  -1,
  -1,
  -1,
  -1,
  -1,
  -1,
  -1,
  -1,
  -1,
  -1,
  -1,
  -1,
  -1,
  -1,
  -1,
  -1,
  -1,
  -1,
  -1,
  -1,
  -1,
  -1,
  -1,
  -1,
  -1,
  -1,
  -1,
  -1,
  -1,
  -1,
  -1,
  -1,
  -1,
  -1,
  -1,
  -1,
  -1,
  -1,
  -1,
  -1,
  -1,
  -1,
  -1
 ],
 "action_target_indices": [
  -1,
  -1,
  -1,
  -1,
  -1,
  -1,
  -1,
  -1,
  -1,
  -1,
  -1,
  -1,
  -1,
  -1,
  -1,
  -1,
  -1,
  -1,
  -1,
  -1,
  -1,
  -1,
  -1,
  -1,
  -1,
  -1,
  -1,
  -1,
  -1,
  -1,
  -1,
  -1,
  -1,
  -1,
  -1,
  -1,
  -1,
  -1,
  -1,
  -1,
  -1,
  -1,
  -1,
  -1,
  -1,
  -1,
  -1,
  -1,
  -1,
  -1,
  -1,
  -1,
  -1,
  -1,
  -1,
  -1,
  -1,
  -1,
  -1,
  -1,
  -1,
  -1,
  -1,
  -1,
  -1,
  -1,
  -1,
  -1,
  -1,
  -1,
  -1,
  -1,
  -1,
  -1,
  -1,
  -1,
  -1,
  -1,
  -1,
  -1,
  -1,
  -1,
  -1,
  -1,
  -1,
  -1,
  -1,
  -1,
  -1,
  -1,
  -1,
  -1,
  -1,
  -1,
  -1,
  -1,
  -1,
  -1,
  -1,
  -1,
  -1,
  -1,
  -1,
  -1,
  -1,
  -1,
  -1,
  -1,
  -1,
  -1,
  -1,
  -1,
  -1,
  -1,
  -1,
  -1,
  -1,
  -1,
  -1,
  -1,
  -1,
  -1,
  -1,
  -1,
  -1,
  -1,
  -1,
  -1,
  -1,
  -1,
  -1,
  -1,
  -1,
  -1,
  -1,
  -1,
  -1,
  -1,
  -1,
  -1,
  -1,
  -1,
  -1,
  -1,
  -1,
  -1,
  -1,
  -1,
  -1,
  -1,
  -1,
  -1,
  -1,
  -1,
  -1,
  -1,
  -1,
  -1,
  -1,
  -1,
  -1,
  -1,
  -1,
  -1,
  -1,
  -1,
  -1,
  -1,
  -1,
  -1,
  -1,
  -1,
  -1,
  -1,
  -1,
  -1,
  -1,
  -1,
  -1,
  -1,
  -1,
  -1,
  -1,
  -1,
  -1,
  -1,
  -1,
  -1,
  -1,
  -1,
  -1,
  -1,
  -1,
  -1,
  -1,
  -1,
  -1,
  -1,
  -1,
  -1,
  -1,
  -1,
  -1,
  -1,
  -1,
  -1,
  -1,
  -1,
  -1,
  -1,
  -1,
  -1,
  -1,
  -1,
  -1,
  -1,
  -1,
  -1,
  -1,
  -1,
  -1,
  -1,
  -1,
  -1,
  -1,
  -1,
  -1,
  -1,
  -1,
  -1,
  -1,
  -1,
  -1,
  -1,
  -1,
  -1,
  -1,
  -1,
  -1,
  -1,
  -1,
  -1,
  -1,
  -1,
  -1,
  -1,
  -1,
  -1,
  -1,
  -1,
  -1,
  -1,
  -1,
  -1,
  -1,
  -1,
  -1,
  -1,
  -1,
  -1,
  -1,
  -1,
  -1,
  -1,
  -1,
  -1,
  -1,
  -1,
  -1,
  -1,
  -1,
  -1,
  -1,
  -1,
  -1,
  -1,
  -1,
  -1,
  -1,
  -1,
  -1,
  -1,
  -1,
  -1,
  -1,
  -1,
  -1,
  -1,
  -1,
  -1,
  -1,
  -1,
  -1,
  -1,
  -1,
  -1,
  -1,
  -1,
  -1,
  -1,
  -1,
  -1,
  -1,
  -1,
  -1,
  -1,
  -1,
  -1,
  -1,
  -1,
  -1,
  -1,
  -1,
  -1,
  -1,
  -1,
  -1,
  -1,
  -1,
  -1,
  -1,
  -1,
  -1,
  -1,
  -1,
  -1,
  -1,
  -1,
  -1,
  -1,
  -1,
  -1,
  -1,
  -1,
  -1,
  -1,
  -1,
  -1,
  -1,
  -1,
  -1,
  -1,
  -1,
  -1,
  -1,
  -1,
  -1,
  -1,
  -1,
  -1,
  -1,
  -1,
  -1,
  -1,
  -1,
  -1,
  -1,
  -1,
  -1,
  -1,
  -1,
  -1,
  -1,
  -1,
  -1,
  -1,
  -1,
  -1,
  -1,
  -1,
  -1,
  -1,
  -1,
  -1,
  -1,
  -1,
  -1,
  -1,
  -1,
  -1,
  -1,
  -1,
  -1,
  -1,
  -1,
  -1,
  -1,
  -1,
  -1,
  -1,
  -1,
  -1,
  -1,
  -1,
  -1,
  -1,
  -1,
  -1,
  -1,
  -1,
  -1,
  -1,
  -1,
  -1,
  -1,
  -1,
  -1,
  -1,
  -1,
  -1,
  -1,
  -1,
  -1,
  -1,
  -1,
  -1,
  -1,
  -1,
  -1,
  -1,
  -1,
  -1,
  -1,
  -1,
  -1,
  -1,
  -1,
  -1,
  -1,
  -1,
  -1,
  -1,
  -1,
  -1,
  -1,
  -1,
  -1,
  -1,
  -1,
  -1,
  -1,
  -1,
  -1,
  -1,
  -1,
  -1,
  -1,
  -1,
  -1,
  -1,
  -1,
  -1,
  -1,
  -1,
  -1,
  -1,
  -1,
  -1,
  -1,
  -1,
  -1,
  -1,
  -1,
  -1,
  -1,
  -1,
  -1,
  -1,
  -1,
  -1,
  -1,
  -1,
  -1,
  -1,
  -1,
  -1,
  -1,
  -1,
  -1,
  -1,
  -1,
  -1,
  -1,
  -1,
  -1,
  -1,
  -1,
  -1,
  -1,
  -1,
  -1,
  -1,
  -1,
  -1,
  -1,
  -1,
  -1,
  -1,
  -1,
  -1,
  -1,
  -1,
  -1,
  -1,
  -1,
  -1,
  -1,
  -1,
  -1,
  -1,
  -1,
  -1
 ],
 "action_kinds": [
  0,
  1,
  1,
  0,
  0,
  0,
  0,
  0,
  0,
  0,
  0,
  0,
  0,
  0,
  0,
  0,
  0,
  0,
  0,
  0,
  0,
  0,
  0,
  0,
  0,
  0,
  0,
  0,
  0,
  0,
  0,
  0,
  0,
  0,
  0,
  0,
  0,
  0,
  0,
  0,
  0,
  0,
  0,
  0,
  0,
  0,
  0,
  0,
  0,
  0,
  0,
  0,
  0,
  0,
  0,
  0,
  0,
  0,
  0,
  0,
  0,
  0,
  0,
  0,
  0,
  0,
  0,
  0,
  0,
  0,
  0,
  0,
  0,
  0,
  0,
  0,
  0,
  0,
  0,
  0,
  0,
  0,
  0,
  0,
  0,
  0,
  0,
  0,
  0,
  0,
  0,
  0,
  0,
  0,
  0,
  0,
  0,
  0,
  0,
  0,
  0,
  0,
  0,
  0,
  0,
  0,
  0,
  0,
  0,
  0,
  0,
  0,
  0,
  0,
  0,
  0,
  0,
  0,
  0,
  0,
  0,
  0,
  0,
  0,
  0,
  0,
  0,
  0,
  0,
  0,
  0,
  0,
  0,
  0,
  0,
  0,
  0,
  0,
  0,
  0,
  0,
  0,
  0,